{
  "kind": "Source",
  "id": "source-iten-2018-smooth-manifold-structure",
  "title": "Smooth manifold structure for extreme channels",
  "authors": [
    "R. Iten",
    "R. Colbeck"
  ],
  "venue": "J. Math. Phys. **59**, 012202 (2018); arXiv:1610.02513.",
  "url": "https://arxiv.org/abs/1610.02513",
  "arxivId": "1610.02513",
  "citation": "R. Iten, R. Colbeck, *Smooth manifold structure for extreme channels*, J. Math. Phys. **59**, 012202 (2018); arXiv:1610.02513."
}
