{
  "kind": "Source",
  "id": "source-mothe-2023",
  "title": "Reassessing the advantage of indefinite causal orders for quantum metrology",
  "authors": [
    "Raphaël Mothe",
    "Cyril Branciard",
    "Alastair A. Abbott"
  ],
  "venue": "Phys. Rev. A 109, 062435 (2024); arXiv:2312.12172 [quant-ph]",
  "url": "https://doi.org/10.1103/PhysRevA.109.062435",
  "doi": "10.1103/PhysRevA.109.062435",
  "arxivId": "2312.12172"
}
