{
  "kind": "Source",
  "id": "source-vrana-2011-the-algebra-of",
  "title": "The algebra of local unitary invariants of identical particles",
  "authors": [
    "P. Vrana"
  ],
  "venue": "arXiv:1107.2438 (2011).",
  "url": "https://arxiv.org/abs/1107.2438",
  "arxivId": "1107.2438",
  "citation": "P. Vrana, *The algebra of local unitary invariants of identical particles*, arXiv:1107.2438 (2011)."
}
