{
  "kind": "Source",
  "id": "source-knill-2000-theory-of-quantum",
  "title": "Theory of quantum error correction for general noise",
  "authors": [
    "E. Knill",
    "R. Laflamme",
    "and L. Viola"
  ],
  "venue": "Phys. Rev. Lett. **84**, 2525 (2000); arXiv:quant-ph/9908066 (1999).",
  "url": "https://arxiv.org/abs/quant-ph/9908066",
  "arxivId": "quant-ph/9908066",
  "citation": "E. Knill, R. Laflamme, and L. Viola, *Theory of quantum error correction for general noise*, Phys. Rev. Lett. **84**, 2525 (2000); arXiv:quant-ph/9908066 (1999)."
}
