{
  "kind": "Source",
  "id": "source-appleby-2025-a-constructive-approach",
  "title": "A Constructive Approach to Zauner's Conjecture via the Stark Conjectures",
  "authors": [
    "M. Appleby",
    "S. T. Flammia",
    "G. S. Kopp"
  ],
  "venue": "arXiv:2501.03970 (2025).",
  "url": "https://arxiv.org/abs/2501.03970",
  "arxivId": "2501.03970",
  "citation": "M. Appleby, S. T. Flammia, G. S. Kopp, *A Constructive Approach to Zauner's Conjecture via the Stark Conjectures*, arXiv:2501.03970 (2025)."
}
