{
  "kind": "Source",
  "id": "source-doi-10-1103-physrevlett-100-120406",
  "title": "Numerics clarify the optimizer but do not prove Part B",
  "authors": [],
  "venue": "Optimization study",
  "url": "https://doi.org/10.1103/PhysRevLett.100.120406",
  "doi": "10.1103/PhysRevLett.100.120406",
  "bibliographyState": "url-only"
}
