{
  "kind": "Source",
  "id": "source-klimesh-2007-inequalities-that-collectively",
  "title": "Inequalities that collectively completely characterize the catalytic majorization relation",
  "authors": [
    "M. Klimesh"
  ],
  "venue": "arXiv:0709.3680 (2007).",
  "url": "https://arxiv.org/abs/0709.3680",
  "arxivId": "0709.3680",
  "citation": "M. Klimesh, *Inequalities that collectively completely characterize the catalytic majorization relation*, arXiv:0709.3680 (2007)."
}
