{
  "kind": "Source",
  "id": "source-arxiv-0706-0705",
  "title": "On the dimension of subspaces with bounded Schmidt rank",
  "authors": [
    "T. S. Cubitt",
    "A. Montanaro",
    "A. Winter"
  ],
  "venue": "arXiv:0706.0705.",
  "url": "https://arxiv.org/abs/0706.0705",
  "arxivId": "0706.0705",
  "citation": "T. S. Cubitt, A. Montanaro and A. Winter, \"On the dimension of subspaces with bounded Schmidt rank,\" arXiv:0706.0705."
}
