{
  "kind": "Source",
  "id": "source-salzger-2026-higher-order-quantum",
  "title": "Higher-order quantum processes respecting closed labs in a spacetime have quantum controlled causal order",
  "authors": [
    "M. Salzger",
    "V. Vilasini"
  ],
  "venue": "arXiv:2605.08351 (2026).",
  "url": "https://arxiv.org/abs/2605.08351",
  "arxivId": "2605.08351",
  "citation": "M. Salzger, V. Vilasini, *Higher-order quantum processes respecting closed labs in a spacetime have quantum controlled causal order*, arXiv:2605.08351 (2026)."
}
