{
  "kind": "Source",
  "id": "source-kruger-2005-some-open-problems",
  "title": "Some Open Problems in Quantum Information Theory",
  "authors": [
    "O. Krüger",
    "R. F. Werner (eds.)"
  ],
  "venue": "arXiv:quant-ph/0504166 (2005), Problem 16 on p. 50; snapshot of the IMaPh open-problems collection, TU Braunschweig — http://www.imaph.tu-bs.de/qi/problems/. DOI: 10.48550/arXiv.quant-ph/0504166.",
  "url": "https://arxiv.org/abs/quant-ph/0504166",
  "arxivId": "quant-ph/0504166",
  "citation": "O. Krüger and R. F. Werner (eds.), *Some Open Problems in Quantum Information Theory*, arXiv:quant-ph/0504166 (2005), Problem 16 on p. 50; snapshot of the IMaPh open-problems collection, TU Braunschweig — http://www.imaph.tu-bs.de/qi/problems/. DOI: 10.48550/arXiv.quant-ph/0504166."
}
