{
  "kind": "Source",
  "id": "source-web-claymath-org-millennium-yang-mills-the",
  "title": "Clay continues to list the problem as unsolved",
  "authors": [],
  "venue": "Clay Mathematics Institute",
  "url": "https://www.claymath.org/millennium/yang-mills-the-maths-gap/",
  "bibliographyState": "url-only"
}
