{
  "kind": "Source",
  "id": "source-johnston-2013-separability-from-spectrum",
  "title": "Separability from spectrum for qubit–qudit states",
  "authors": [
    "N. Johnston"
  ],
  "venue": "Phys. Rev. A **88**, 062330 (2013); arXiv:1309.2006.",
  "url": "https://arxiv.org/abs/1309.2006",
  "arxivId": "1309.2006",
  "citation": "N. Johnston, *Separability from spectrum for qubit–qudit states*, Phys. Rev. A **88**, 062330 (2013); arXiv:1309.2006."
}
