{
  "kind": "Source",
  "id": "source-xiong-2024-criteria-of-absolutely",
  "title": "Criteria of absolutely separability from spectrum for qudit-qudits states",
  "authors": [
    "L. Xiong",
    "N.-S. Sze"
  ],
  "venue": "arXiv:2408.11684 (2024). Cited as an unaccepted general-resolution claim; see the status discussion.",
  "url": "https://arxiv.org/abs/2408.11684",
  "arxivId": "2408.11684",
  "citation": "L. Xiong, N.-S. Sze, *Criteria of absolutely separability from spectrum for qudit-qudits states*, arXiv:2408.11684 (2024). Cited as an unaccepted general-resolution claim; see the status discussion."
}
