{
  "kind": "Source",
  "id": "source-web-quantum-journal-org-papers-q-2026",
  "title": "Current key-cost theory still treats zero-key entanglement as unresolved",
  "authors": [],
  "venue": "Quantum 2026",
  "url": "https://quantum-journal.org/papers/q-2026-05-06-2098/",
  "bibliographyState": "url-only"
}
