{
  "kind": "Source",
  "id": "source-staufenbiel-2026-bell-inequalities-from",
  "title": "Bell Inequalities from Polyhedral Sampling",
  "authors": [
    "C. Staufenbiel"
  ],
  "venue": "arXiv:2604.22859 (2026 preprint).",
  "url": "https://arxiv.org/abs/2604.22859",
  "arxivId": "2604.22859",
  "citation": "C. Staufenbiel, *Bell Inequalities from Polyhedral Sampling*, arXiv:2604.22859 (2026 preprint)."
}
