{
  "kind": "Source",
  "id": "source-liu-2007-phys-rev-lett",
  "title": "Phys. Rev. Lett",
  "authors": [
    "Y.-K. Liu",
    "M. Christandl",
    "F. Verstraete",
    "\"$N$-representability is QMA-complete\""
  ],
  "venue": "98 (2007), 110503; arXiv:quant-ph/0609125.",
  "url": "https://arxiv.org/abs/quant-ph/0609125",
  "arxivId": "quant-ph/0609125",
  "citation": "Y.-K. Liu, M. Christandl, F. Verstraete, \"$N$-representability is QMA-complete\", *Phys. Rev. Lett.* 98 (2007), 110503; arXiv:quant-ph/0609125."
}
